{
  "$schema": "https://json-schema.org/draft/2020-12/schema",
  "$id": "https://divide.local/schema/dataset-manifest-v1.json",
  "type": "object",
  "additionalProperties": false,
  "required": ["schema_version", "dataset_id", "root", "artifacts"],
  "properties": {
    "schema_version": {"const": "1.0"},
    "dataset_id": {"type": "string", "minLength": 1},
    "root": {"type": "string", "minLength": 1},
    "artifacts": {
      "type": "array",
      "items": {
        "type": "object",
        "additionalProperties": false,
        "required": ["artifact_id", "project_id", "relative_path", "sha256", "mime", "secrets"],
        "properties": {
          "artifact_id": {"type": "string", "minLength": 1},
          "project_id": {"type": "string", "minLength": 1},
          "relative_path": {"type": "string", "minLength": 1},
          "sha256": {"type": "string", "pattern": "^[0-9a-f]{64}$"},
          "mime": {"type": "string", "minLength": 1},
          "secrets": {
            "type": "array",
            "items": {
              "type": "object",
              "additionalProperties": false,
              "required": ["fingerprint", "location"],
              "properties": {
                "fingerprint": {"type": "string", "pattern": "^[0-9a-f]{64}$"},
                "location": {"type": "string"},
                "credential_type": {"type": "string"}
              }
            }
          }
        }
      }
    }
  }
}
